<?xml version="1.0" encoding="UTF-8"?>
<archive xmlns:xsi="http://www.w3.org/2001/XMLSchema-instance" xsi:noNamespaceSchemaLocation="..\..\..\resources\schemas\archive.xsd">
	<tournament name="Tournament-séquence court" type="sequence" />
	<played matches="1" rounds="4" />
	<dates start="2009-02-09T21:37:26" save="2009-02-09T21:46:52" />
	<players>
		<player name="0809v2.Altay+Basaranoğlu" />
		<player name="0809v2.Erişik+Pektaş" />
		<player name="0809v2.Günalp+Yürtsever" />
		<player name="Joueur humain" />
	</players>
</archive>

